name,tags,about,img_url
This Is Fine,"
reaction image, dog, fire, web comic, gunshow, kc green, this is fine, theonefoster, k.c. green, the nib, matt bors, nick kaman, richard burr, davidmackau
","This Is Fine is a two-pane image of an anthropomorphic dog trying to assure himself that everything is fine, despite sitting in a room that is engulfed in flames. Taken from an issue of the webcomic series Gunshow illustrated by K.C. Green and published in early January 2013, the cartoon is typically used as a reaction image to convey a sense of self-denial or acceptance in the face of a hopeless situation.",https://i.kym-cdn.com/entries/icons/mobile/000/018/012/this_is_fine.jpg
Fus Ro Dah,"
dragon, skyrim, shout, thu'um, fus roh dah, fus do rah, atatadadada, sparkyxx
",Warning: this entry contains spoilers for the game Elder Scrolls V: Skyrim.,https://i.kym-cdn.com/entries/icons/square/000/007/573/thu__um_by_breaktroll-d356vd2.jpg
Success Kid / I Hate Sandcastles,"
kids, exploitable, baby, success kid, success, advice animal, sandcastles, roflcon iii, victory baby, laney griner, irishprof, pleated jeans, vitamin water, @whitehouse
",,https://i.kym-cdn.com/entries/icons/mobile/000/000/745/success.jpg
2/10 Would Not Bang,"
2, 10, bang, women, attractive, wouldn't bang, would bang, notables of 2012, rating, beauty, stacy keibler, carla harvey, studman69
","2/10 Would Not Bang is an image macro series in which photos of physically attractive women (and occasionally men) are scrutinized for minor or imagined flaws, prefaced by an ironically low rating on a scale of one to ten. The images are meant to parody hypercritical judgments made about women’s sex appeal on the Internet.",https://i.kym-cdn.com/entries/icons/mobile/000/008/486/wouldnotbang.jpg
Aww Yea Guy,"
image macro, catchphras, e 4-panel, 4chan, funnyjunk, aw yea
",,https://i.kym-cdn.com/entries/icons/mobile/000/005/365/fuck-yeah-aww-yeah-l-1_copy.jpg
Rickroll,"
rick roll, rickrolling, rick astley, music video, 80s, bait, pop icon, pop culture obscura, blacklist, nostalgia, cotter548, househub, pete waterman, will smidlein, the foo fighters, mario van poppel
","Rickrolling is a bait-and-switch prank that involves posting a hyperlink that is supposedly relevant to the topic at hand in an online discussion, but re-directs the viewer to the music video of ""Never Gonna Give You Up,"" a 1987 dance pop single by English singer-songwriter Rick Astley. Since May 2007, numerous versions of the music video on YouTube have garnered hundreds of millions, largely driven by the widespread practice of ""rickrolling"" and subsequent resurgence in popularity of the song over the following decade.",https://i.kym-cdn.com/entries/icons/mobile/000/000/007/bd6.jpg
Virgin vs. Chad,"
pyrussolus, hardflips, virgin, chad, wizard, r9k, ms paint, comparison, chad vs virgin meme
","Virgin vs. Chad, also known as Virgin Walk, refers to a series of illustrations comparing various ""virgin"" men with low self-confidence to their Chad Thundercock counterparts. After an MS Paint depiction of the walk began circulating online in March 2017, other illustrations of ""virgin"" behaviors began appearing on the /r9k/ board on 4chan.",https://i.kym-cdn.com/entries/icons/mobile/000/023/200/cover8.jpg
Distracted Boyfriend,"
stock photo, image macro, jealousy, unfaithful guy, istock, disloyal man with his girlfriend looking at another girl, prog düşmanlarına verilen müthiş cevaplar, stock photograph, danikger, klubbhead, toastr, j0aco777, stew, mission impos, antonio guillem
","Distracted Boyfriend, also known as Man Looking at Other Woman, is an object labeling stock photo series in which a man looks at the backside of a woman walking by while another woman, presumably his romantic partner, looks on disapprovingly.",https://i.kym-cdn.com/entries/icons/mobile/000/023/732/damngina.jpg
He Protec but He Also Attac,"
image macro, protecc, attacc, b3pis, sketchymemes, mradordeplor, lester green, fijichecks
","He Protec but He Also Attac is an intentionally misspelled variation of the expression, ""He protects, but he also attacks,"" which is used online to caption various image macros featuring subjects preparing to defend against or engage an enemy.",https://i.kym-cdn.com/entries/icons/mobile/000/022/574/a7c.jpg
Karen,"
she took the fucking kids, annoying, pejorative, speak to the manager, bethany, joematar, ashleyallday, /r/fuckyoukaren, cody kolodziejzyk, goodfellas, antagonistic female, karen definition slang
","Karen is a slang term used as an antagonistic female character in memes. ""Karen"" is generally characterized as an irritating, entitled woman, sometimes as an ex-wife who took custody of ""the kids."" In 2020, the term was broadly applied to a swath of white women who had been filmed harassing people of color, including dialing the emergency services on them for no criminal reason.",https://i.kym-cdn.com/entries/icons/mobile/000/027/963/karenimg.jpg
Musically Oblivious 8th Grader,"
tumblr, emileina, memegenerator, image macro, music, naive, faux pas, social stereotype
",,https://i.kym-cdn.com/entries/icons/mobile/000/001/895/MO8G_Temp2.jpg
Smile.jpg,"
creepy, copypasta, creepypasta, paranormal, smile.jpg
","Smile,jpg, also known as Smile.dog, is a creepypasta story about a haunted image that drives those who view it insane. The tale is often accompanied by a photoshopped picture of a sinister-looking Siberian Husky dog.",https://i.kym-cdn.com/entries/icons/mobile/000/003/269/smilejpg.jpg
